name,ALIGN,EYE,HAIR,SEX,GSM,APPEARANCES,YEAR
Otto von Belzig (New Earth),Bad Characters,,,Male Characters,,2,2010
Phil (New Earth),Good Characters,Black Eyes,Brown Hair,Male Characters,,2,2010
Pisces (New Earth),Bad Characters,,,Male Characters,,2,2010
Professional Scotsman (New Earth),Good Characters,,Grey Hair,Male Characters,,2,2010
Rush Hour II (New Earth),,,Black Hair,Male Characters,,2,2010
Sebastian Rothschild (New Earth),Bad Characters,Black Eyes,Black Hair,Male Characters,,2,2010
Settler I (New Earth),,,,Male Characters,,2,2010
Space Cadet (New Earth),,,,Female Characters,,2,2010
Spike II (New Earth),Bad Characters,,,Male Characters,,2,2010
Tangle (New Earth),Bad Characters,,White Hair,Male Characters,,2,2010
Tongs (New Earth),Good Characters,,,Male Characters,,2,2010
Viktor Burgos (New Earth),Bad Characters,,,Male Characters,,2,2010
Zero (New Earth),,,,Male Characters,,2,2010
Ace of Clubs III (New Earth),Bad Characters,,,Male Characters,,2,2009
Ace of Diamonds II (New Earth),Bad Characters,,,Male Characters,,2,2009
Ace of Hearts II (New Earth),Bad Characters,,,Male Characters,,2,2009
Agent Liberty II (New Earth),Good Characters,,,Female Characters,,2,2009
Ak-Var (New Earth),Neutral Characters,,Blond Hair,Male Characters,,2,2009
Alkistis (New Earth),Good Characters,,Brown Hair,Female Characters,,2,2009
Beaumont (New Earth),Good Characters,,Blond Hair,Male Characters,,2,2009
Big Game (New Earth),Bad Characters,,Red Hair,Male Characters,,2,2009
Blake (New Earth),Bad Characters,,Brown Hair,Male Characters,,2,2009
Boss Bishonen (New Earth),Good Characters,,,Male Characters,,2,2009
Catherine Hamilton (New Earth),Neutral Characters,Green Eyes,Brown Hair,Female Characters,,2,2009
Deadcoil (New Earth),Bad Characters,,,Male Characters,,2,2009
Deadly Force (New Earth),Bad Characters,,,Male Characters,,2,2009
Djo Dje (New Earth),,,,Male Characters,,2,2009
Djo Mek (New Earth),,,,Male Characters,,2,2009
Djo Sut (New Earth),,,,Male Characters,,2,2009
Dregz (New Earth),Bad Characters,,Brown Hair,Male Characters,,2,2009
Frederick Abberline (New Earth),Good Characters,Blue Eyes,Black Hair,Male Characters,,2,2009
Gabriel Santo (New Earth),Bad Characters,,Black Hair,Male Characters,,2,2009
Jack of Hearts III (New Earth),Bad Characters,,,Male Characters,,2,2009
Jennifer Rice (New Earth),Good Characters,,Black Hair,Female Characters,,2,2009
Khaji Eq (New Earth),,,,Male Characters,,2,2009
Khaji Ro (New Earth),,,,Female Characters,,2,2009
Khaji Tal (New Earth),,,,Male Characters,,2,2009
King of Hearts III (New Earth),Bad Characters,,,Male Characters,,2,2009
Leland McCauley (New Earth),Good Characters,,White Hair,Male Characters,,2,2009
Lyle Blanco (New Earth),Bad Characters,Blue Eyes,Blond Hair,Male Characters,,2,2009
Mister Toad (New Earth),Bad Characters,,,Male Characters,,2,2009
Mur (New Earth),Bad Characters,Brown Eyes,Brown Hair,Male Characters,,2,2009
Nazo Baluda (New Earth),Good Characters,,,Female Characters,,2,2009
Orlan (New Earth),Good Characters,White Eyes,,Male Characters,,2,2009
Queen of Hearts IV (New Earth),Bad Characters,,,Female Characters,,2,2009
Robo-Octo-Ape (New Earth),Bad Characters,,,,,2,2009
Samuel Aerons (New Earth),Good Characters,,,Male Characters,,2,2009
Sunny Jim (New Earth),Good Characters,,Blond Hair,Male Characters,,2,2009
Ten of Hearts I (New Earth),Bad Characters,,,Female Characters,,2,2009
Tes Ak-Var (New Earth),Neutral Characters,,Red Hair,Female Characters,,2,2009
Todd Rice (Some Years Later),Good Characters,Brown Eyes,Brown Hair,Male Characters,Homosexual Characters,2,2009
Akhlut (New Earth),Bad Characters,Black Eyes,Black Hair,Male Characters,,2,2008
Alcinoe (New Earth),,,Strawberry Blond Hair,Female Characters,,2,2008
Brother Drive (New Earth),,,Brown Hair,Male Characters,,2,2008
Brother Think (New Earth),,,Black Hair,Male Characters,,2,2008
Clarice Coeur (New Earth),Good Characters,,,Female Characters,,2,2008
Dai Yokohama (New Earth),Good Characters,,,Male Characters,,2,2008
Empathy (New Earth),Good Characters,Blue Eyes,Red Hair,Female Characters,,2,2008
Honor Jackson (New Earth),Neutral Characters,,Black Hair,Male Characters,,2,2008
J.A.K.E. 6.1 (New Earth),Good Characters,,,Male Characters,,2,2008
Jake Donnelly (New Earth),Neutral Characters,Brown Eyes,Black Hair,Male Characters,,2,2008
Jonathan Banks (New Earth),Bad Characters,,Blond Hair,Male Characters,,2,2008
Kane Milohai (New Earth),Good Characters,Brown Eyes,Brown Hair,Male Characters,,2,2008
Lone-Eye Lincoln (New Earth),Neutral Characters,,,Male Characters,,2,2008
Primat (New Earth),Good Characters,,,Female Characters,,2,2008
Sabine Roth (New Earth),Good Characters,Brown Eyes,Grey Hair,Female Characters,,2,2008
Unknown Lantern (New Earth),,,,,,2,2008
William Brannon (New Earth),Neutral Characters,,,Male Characters,,2,2008
Allison Addison (New Earth),,Blue Eyes,Brown Hair,Female Characters,,2,2007
Artis Chep (New Earth),Good Characters,,,Male Characters,,2,2007
Bizarro Batman (New Earth),Neutral Characters,,,Male Characters,,2,2007
Bizarro Brainiac (New Earth),Neutral Characters,Green Eyes,,Male Characters,,2,2007
Bizarro Doomsday (New Earth),Bad Characters,Black Eyes,Black Hair,Male Characters,,2,2007
Bizarro Mxyzptlk (New Earth),,,White Hair,Male Characters,,2,2007
Carface (New Earth),Bad Characters,,,Male Characters,,2,2007
Clownfish (New Earth),Bad Characters,,,Male Characters,,2,2007
Cunningham (New Earth),Bad Characters,,,Male Characters,,2,2007
Dev-Em (New Earth),Bad Characters,Green Eyes,Purple Hair,Male Characters,,2,2007
Eduardo Flamingo (New Earth),Bad Characters,,Pink Hair,Male Characters,,2,2007
Jarod Dale (New Earth),,Brown Eyes,Blond Hair,Male Characters,,2,2007
Julie Greer (New Earth),,Brown Eyes,Blond Hair,Female Characters,,2,2007
Ken Thurston (New Earth),Good Characters,Brown Eyes,Brown Hair,Male Characters,,2,2007
Larra (New Earth),Bad Characters,,,Female Characters,,2,2007
Macro (New Earth),Bad Characters,Blue Eyes,Red Hair,Female Characters,,2,2007
Magda (New Earth),Bad Characters,Brown Eyes,Black Hair,Female Characters,,2,2007
Major Victory IV (New Earth),Bad Characters,,Blond Hair,Male Characters,,2,2007
Manhunter Lud (New Earth),Bad Characters,,,Male Characters,,2,2007
Micro (New Earth),Bad Characters,,Black Hair,Male Characters,,2,2007
Mircea (New Earth),Bad Characters,White Eyes,Black Hair,Male Characters,,2,2007
Seer Ruggle (New Earth),Bad Characters,,,Female Characters,,2,2007
Trey Thompson (New Earth),Good Characters,Blue Eyes,Black Hair,Male Characters,,2,2007
Uriah (New Earth),Bad Characters,Black Eyes,Black Hair,Male Characters,,2,2007
Warbox (New Earth),Bad Characters,Photocellular Eyes,,Male Characters,,2,2007
Zaneth (New Earth),Good Characters,,,Male Characters,,2,2007
Badlands (New Earth),Bad Characters,,,Male Characters,,2,2006
Bottom Feeder (New Earth),Bad Characters,,,Male Characters,,2,2006
Danae (New Earth),,,Brown Hair,Female Characters,,2,2006
Didiu (New Earth),,,Brown Hair,Female Characters,,2,2006
Dru-Zod I (New Earth),Bad Characters,,,Male Characters,,2,2006
Edogawa Sangaku (New Earth),,,,Male Characters,,2,2006
Fireball II (New Earth),Bad Characters,,Brown Hair,Male Characters,,2,2006
Fright Knight (New Earth),Bad Characters,,,Male Characters,,2,2006
Georgia Sivana (New Earth),,,Brown Hair,Female Characters,,2,2006
Iolan (New Earth),,,Blond Hair,Female Characters,,2,2006
Jon Standing Bear (New Earth),Good Characters,Brown Eyes,Black Hair,Male Characters,,2,2006
Lowell Jeffries (New Earth),Neutral Characters,,,Male Characters,,2,2006
Monsoon II (New Earth),Bad Characters,,,Female Characters,,2,2006
Mug (New Earth),Bad Characters,,,Male Characters,,2,2006
Propaganda (New Earth),Bad Characters,,,Male Characters,,2,2006
Pulsar (New Earth),Good Characters,,,Male Characters,,2,2006
Qanda (New Earth),Good Characters,Green Eyes,Orange Hair,Female Characters,,2,2006
Redback Spider (New Earth),Bad Characters,,,Female Characters,,2,2006
Robert Castell (New Earth),Neutral Characters,Brown Eyes,Black Hair,Male Characters,,2,2006
Slipknot II (New Earth),Bad Characters,,,Male Characters,,2,2006
Spin Doctor I (New Earth),Bad Characters,,Red Hair,Male Characters,,2,2006
"Thaddeus Sivana, Jr. (New Earth)",,,Brown Hair,Male Characters,,2,2006
Thormon Tox (New Earth),Good Characters,Blue Eyes,Blond Hair,Male Characters,,2,2006
Vera Klopis (New Earth),Bad Characters,,Pink Hair,Female Characters,,2,2006
William Slout (New Earth),,,Grey Hair,Male Characters,,2,2006
Ace of Spades V (New Earth),Bad Characters,,,Male Characters,,2,2005
Aftermath (New Earth),Bad Characters,,Blond Hair,Male Characters,,2,2005
All-Beard (New Earth),Bad Characters,Brown Eyes,Grey Hair,Male Characters,,2,2005
Beulah Bleak (New Earth),Neutral Characters,,,Female Characters,,2,2005
Callisto (New Earth),,,Blond Hair,Female Characters,,2,2005
Charity Bleak (New Earth),Neutral Characters,Black Eyes,Black Hair,Female Characters,,2,2005
Charliehorse (New Earth),Bad Characters,Black Eyes,Brown Hair,Male Characters,,2,2005
Crazyface (New Earth),Neutral Characters,,,Male Characters,,2,2005
Dino-Mite II (New Earth),Bad Characters,,,Male Characters,,2,2005
Dreamcatcher (New Earth),Bad Characters,,,Genderless Characters,,2,2005
Eamon Garcia (New Earth),Bad Characters,Black Eyes,,Male Characters,,2,2005
Erich Thonius (New Earth),Good Characters,,Blond Hair,Male Characters,,2,2005
Fishmonger (New Earth),Bad Characters,,,Male Characters,,2,2005
Harris D. Ledbetter (New Earth),Good Characters,,Blond Hair,Male Characters,,2,2005
Harvest I (New Earth),Bad Characters,,Black Hair,Female Characters,,2,2005
Helen Helligan (New Earth),Good Characters,Brown Eyes,Brown Hair,Female Characters,,2,2005
Hindenberg (New Earth),Bad Characters,,,Male Characters,,2,2005
Hollywood (New Earth),Good Characters,Green Eyes,Red Hair,Female Characters,,2,2005
Horigal (New Earth),Bad Characters,Yellow Eyes,Black Hair,Male Characters,,2,2005
Kellogg (New Earth),Bad Characters,,,Male Characters,,2,2005
Kid Impala (New Earth),Good Characters,,Black Hair,Male Characters,,2,2005
Millions (New Earth),Good Characters,Black Eyes,White Hair,Male Characters,,2,2005
Monkey-in-the-Middle (New Earth),Bad Characters,,,Male Characters,,2,2005
Peredur (New Earth),Good Characters,,,Male Characters,,2,2005
Sadeh (New Earth),,,Brown Hair,Female Characters,,2,2005
Scramjet (New Earth),Bad Characters,,,Male Characters,,2,2005
Shelly Gaynor (New Earth),Good Characters,Blue Eyes,Blond Hair,Female Characters,,2,2005
Strato (New Earth),Neutral Characters,Black Eyes,Grey Hair,Male Characters,,2,2005
Submissionary Judah (New Earth),Neutral Characters,Black Eyes,Black Hair,Male Characters,,2,2005
Ten of Spades V (New Earth),Bad Characters,,Red Hair,Female Characters,,2,2005
William Beezer (New Earth),Bad Characters,Brown Eyes,Blond Hair,Male Characters,,2,2005
Witchazel (New Earth),Bad Characters,,Purple Hair,Female Characters,,2,2005
Yellow of the Rainbow Raiders (New Earth),Bad Characters,,,Female Characters,,2,2005
Zhang Xiaomei (New Earth),Bad Characters,White Eyes,,Female Characters,,2,2005
Akahara (New Earth),Bad Characters,,Black Hair,Male Characters,,2,2004
Andrew Lopez (New Earth),Good Characters,,Black Hair,Male Characters,,2,2004
Benjamin Addison (New Earth),Neutral Characters,,,Male Characters,,2,2004
Casey Krinsky (New Earth),Bad Characters,Hazel Eyes,Blond Hair,Female Characters,,2,2004
David Davies (New Earth),Good Characters,,,Male Characters,,2,2004
Erik Verdalian (New Earth),Bad Characters,,Black Hair,Male Characters,,2,2004
Henry Kucharski (New Earth),Good Characters,Blue Eyes,Blond Hair,Male Characters,,2,2004
Melinda Spyros (New Earth),Good Characters,,Brown Hair,Female Characters,,2,2004
Travonn Williams (New Earth),Neutral Characters,,,Male Characters,,2,2004
Wormhole (New Earth),Bad Characters,Blue Eyes,Brown Hair,Male Characters,,2,2004
Anne Carver (New Earth),,Brown Eyes,Brown Hair,Female Characters,,2,2003
Fleshburn (New Earth),Bad Characters,,,Male Characters,,2,2003
Great White (New Earth),Bad Characters,,,Male Characters,,2,2003
Kid Scout (New Earth),Good Characters,,Red Hair,Male Characters,,2,2003
Kobe Asuru (New Earth),Good Characters,,Brown Hair,Male Characters,,2,2003
Lunkhead (New Earth),Bad Characters,,,Male Characters,,2,2003
Rebecca Muldoon (New Earth),,,Black Hair,Female Characters,,2,2003
Zaladin (New Earth),Bad Characters,White Eyes,Black Hair,Male Characters,,2,2003
Antiphon (New Earth),Bad Characters,Blue Eyes,Blond Hair,Male Characters,,2,2002
Black Barax (New Earth),Bad Characters,,,Male Characters,,2,2002
Digital Djinn (New Earth),Bad Characters,,,Male Characters,,2,2002
Hyve (New Earth),Bad Characters,,,Male Characters,,2,2002
Izanami (New Earth),Bad Characters,Yellow Eyes,Black Hair,,,2,2002
Jack of Spades V (New Earth),Bad Characters,,,Male Characters,,2,2002
Kaleeza Fashed (New Earth),Good Characters,,,Female Characters,,2,2002
Madame X (New Earth),Bad Characters,Blue Eyes,White Hair,Female Characters,,2,2002
Mixcoatl (New Earth),,,,,,2,2002
Nine of Diamonds I (New Earth),Bad Characters,Brown Eyes,Brown Hair,Female Characters,,2,2002
Scorcher IV (New Earth),Bad Characters,,Black Hair,Female Characters,,2,2002
Siv (New Earth),Good Characters,,Blue Hair,Male Characters,,2,2002
Tolteca (New Earth),Bad Characters,Blue Eyes,Black Hair,Female Characters,,2,2002
Alesandra Taracon (New Earth),Neutral Characters,,,Female Characters,,2,2001
Antino\u00f6s (New Earth),Good Characters,,,,,2,2001
Canis Major (New Earth),Bad Characters,,,Male Characters,,2,2001
General Good (New Earth),Bad Characters,Brown Eyes,Brown Hair,Male Characters,,2,2001
Hypnotic Woman (New Earth),Bad Characters,,,Female Characters,,2,2001
Kru-El (New Earth),Bad Characters,Brown Eyes,Black Hair,Male Characters,,2,2001
Matatoa (New Earth),Bad Characters,Black Eyes,Blond Hair,Male Characters,,2,2001
Matches Malone (New Earth),Bad Characters,Blue Eyes,Brown Hair,Male Characters,,2,2001
Princess Maru (New Earth),Bad Characters,,Black Hair,Female Characters,,2,2001
Zara (New Earth),Bad Characters,,Brown Hair,Female Characters,,2,2001
Aruna Shende (New Earth),Good Characters,Brown Eyes,Black Hair,Genderless Characters,,2,2000
Aten (New Earth),Good Characters,Red Eyes,,Male Characters,,2,2000
Blue Ice (New Earth),Bad Characters,,Black Hair,Female Characters,,2,2000
Cachiru (New Earth),Good Characters,Blue Eyes,Black Hair,Male Characters,,2,2000
Calvin Broderick (New Earth),Bad Characters,,Black Hair,Male Characters,,2,2000
Doctor Echo (New Earth),Bad Characters,,Black Hair,Male Characters,,2,2000
Doll Girl II (New Earth),Good Characters,,,Female Characters,,2,2000
Dolores Pratchet (New Earth),Bad Characters,Red Eyes,Red Hair,Female Characters,,2,2000
Drakul Karfang (New Earth),Bad Characters,Red Eyes,,Female Characters,,2,2000
Ebikar Hrui (New Earth),Good Characters,Yellow Eyes,Green Hair,Male Characters,,2,2000
El Bagual (New Earth),Good Characters,,,Male Characters,,2,2000
Saraday (New Earth),Good Characters,,Brown Hair,Female Characters,,2,2000
Scarlet Scythe (New Earth),Bad Characters,,,Male Characters,,2,2000
Vizacacha (New Earth),Good Characters,,,Male Characters,,2,2000
Acolyte (New Earth),Bad Characters,Red Eyes,Blue Hair,Male Characters,,2,1999
Anti-Hero (New Earth),Bad Characters,,,Male Characters,,2,1999
Anya Savenlovich (New Earth),Good Characters,Green Eyes,Red Hair,Female Characters,,2,1999
Badmouth (New Earth),Good Characters,,Black Hair,Male Characters,,2,1999
Bette Noir (New Earth),Bad Characters,Grey Eyes,Black Hair,Female Characters,,2,1999
Brahma (New Earth),Neutral Characters,,,Male Characters,,2,1999
Dante (New Earth),Bad Characters,Red Eyes,Brown Hair,Male Characters,,2,1999
Dolmen (New Earth),Bad Characters,Brown Eyes,Brown Hair,Male Characters,,2,1999
Ebenezer Biggs (New Earth),Bad Characters,Brown Eyes,Blond Hair,Male Characters,,2,1999
Edward Skeevers (New Earth),Bad Characters,,Black Hair,Male Characters,,2,1999
Fireworks (New Earth),Good Characters,,Blond Hair,Female Characters,,2,1999
Freight-Train (New Earth),Good Characters,,Blond Hair,Male Characters,,2,1999
Ganesh (New Earth),Good Characters,,,Male Characters,,2,1999
Hammeroon (New Earth),Good Characters,Brown Eyes,Brown Hair,Male Characters,,2,1999
Hanuman (New Earth),Neutral Characters,Brown Eyes,Brown Hair,Male Characters,,2,1999
Henry Lee Jordan (New Earth),Good Characters,,Brown Hair,Male Characters,,2,1999
Ishi-Shujou (New Earth),Bad Characters,,Black Hair,Male Characters,,2,1999
Kathryn Monaghan (New Earth),Good Characters,,Black Hair,Female Characters,,2,1999
Lucia Viti (New Earth),Bad Characters,Blue Eyes,Brown Hair,Female Characters,,2,1999
Mahadevi (New Earth),,,Black Hair,Female Characters,,2,1999
Nelson Arling (New Earth),Bad Characters,,,Male Characters,,2,1999
Packrat (New Earth),Bad Characters,Green Eyes,Brown Hair,Male Characters,,2,1999
Paul Deisinger (New Earth),Bad Characters,,Black Hair,Male Characters,,2,1999
Prohl Gosgotha (New Earth),Good Characters,Blue Eyes,,Male Characters,,2,1999
Rao (New Earth),Good Characters,,,Male Characters,,2,1999
Roo (New Earth),Good Characters,,Blond Hair,Male Characters,,2,1999
Sela Allen (New Earth),Good Characters,White Eyes,,Female Characters,,2,1999
Thomas Dawson (New Earth),Bad Characters,,Grey Hair,Male Characters,,2,1999
Timothy Townsend (New Earth),Good Characters,,Blond Hair,Male Characters,,2,1999
Trafalgo (New Earth),Good Characters,,Black Hair,Male Characters,,2,1999
Wardell Washington (New Earth),Bad Characters,Brown Eyes,Black Hair,Male Characters,,2,1999
Zolog (New Earth),Good Characters,,Black Hair,Male Characters,,2,1999
Flex II (New Earth),Bad Characters,,Black Hair,Male Characters,,2,1998
Lee St. Lawrence (New Earth),Good Characters,,Blond Hair,Female Characters,,2,1998
Legless Master (New Earth),Neutral Characters,,,Male Characters,,2,1998
Major Flashback (New Earth),Good Characters,,Blond Hair,Male Characters,,2,1998
Nina Dowd (New Earth),Bad Characters,Green Eyes,,Female Characters,,2,1998
Pallas (New Earth),Good Characters,Brown Eyes,Black Hair,Female Characters,,2,1998
Red Panzer II (New Earth),Bad Characters,,,Male Characters,,2,1998
Sally Marsden (New Earth),,Green Eyes,Red Hair,Female Characters,,2,1998
Sister Sunlight (New Earth),Good Characters,Blue Eyes,Blond Hair,Female Characters,,2,1998
Thalia (New Earth),Good Characters,,,Female Characters,,2,1998
Thermal (New Earth),Bad Characters,,Black Hair,Female Characters,,2,1998
Bernell Jones (New Earth),Good Characters,Brown Eyes,Brown Hair,Male Characters,,2,1997
Celestia (New Earth),Good Characters,,Grey Hair,Female Characters,,2,1997
Christina Chiles (New Earth),Bad Characters,,,Female Characters,,2,1997
Cynthia Brand (New Earth),Bad Characters,Green Eyes,Red Hair,Female Characters,,2,1997
Desmond Connor (New Earth),Bad Characters,,Brown Hair,Male Characters,,2,1997
Emily Washburn (New Earth),Neutral Characters,,Blond Hair,Female Characters,,2,1997
Ferris Boyle (New Earth),Bad Characters,,Black Hair,Male Characters,,2,1997
Frankie Carbone (New Earth),Bad Characters,,Brown Hair,Male Characters,,2,1997
Gamesman (New Earth),Bad Characters,Blue Eyes,,Male Characters,,2,1997
Getaway Jones (New Earth),Bad Characters,,,Male Characters,,2,1997
Joe Bandano (New Earth),Bad Characters,,Brown Hair,Male Characters,,2,1997
Joseph Minette (New Earth),Bad Characters,,Brown Hair,Male Characters,,2,1997
Kenneth Wayne (New Earth),Good Characters,,Black Hair,Male Characters,,2,1997
Luigi Maroni (New Earth),Bad Characters,,Grey Hair,Male Characters,,2,1997
Machine Messiah (New Earth),Bad Characters,,,,,2,1997
Marlon Dall (New Earth),Bad Characters,Brown Eyes,Brown Hair,Male Characters,,2,1997
Orunmilla (New Earth),Neutral Characters,Brown Eyes,Black Hair,Male Characters,,2,1997
Rhombus (New Earth),Bad Characters,Black Eyes,White Hair,Male Characters,,2,1997
Thurber Avian (New Earth),Bad Characters,,,Male Characters,,2,1997
Abigail Moorland (New Earth),Bad Characters,,Black Hair,Female Characters,,2,1996
Adele Drew (New Earth),,Brown Eyes,Brown Hair,Female Characters,,2,1996
Bang Bang (New Earth),Bad Characters,Black Eyes,Black Hair,Female Characters,,2,1996
Brawl (New Earth),Bad Characters,,,Male Characters,,2,1996
Burton Thompson (New Earth),,Brown Eyes,Brown Hair,Male Characters,,2,1996
Daniel Maris (New Earth),Bad Characters,,Brown Hair,Male Characters,,2,1996
Death-Doll (New Earth),Bad Characters,Blue Eyes,Blond Hair,Female Characters,,2,1996
Eva Green (New Earth),Bad Characters,Blue Eyes,Blond Hair,Female Characters,,2,1996
Gerald McWilliams (New Earth),Neutral Characters,,,Male Characters,,2,1996
Helen Belcanto (New Earth),Bad Characters,Brown Eyes,Black Hair,Female Characters,,2,1996
Holly Green (New Earth),Bad Characters,Blue Eyes,Blond Hair,Female Characters,,2,1996
Hugh Danzizen (New Earth),Good Characters,,Brown Hair,Male Characters,,2,1996
John Adams (New Earth),Good Characters,,,Male Characters,,2,1996
Kekona (New Earth),Bad Characters,Brown Eyes,,Male Characters,,2,1996
Lizard King (New Earth),Bad Characters,,Brown Hair,Male Characters,,2,1996
Patty Patty (New Earth),Bad Characters,Black Eyes,Blond Hair,Female Characters,,2,1996
Sinthia (New Earth),Bad Characters,,Brown Hair,Female Characters,,2,1996
Stanley Macklin (New Earth),Bad Characters,,,Male Characters,,2,1996
Stayne (New Earth),Bad Characters,,,Female Characters,,2,1996
Susan Kent (New Earth),Good Characters,,Grey Hair,Female Characters,,2,1996
Synth (New Earth),Bad Characters,,,Male Characters,,2,1996
Twilight (New Earth),Bad Characters,,,Female Characters,,2,1996
Warhammer (New Earth),Good Characters,Blue Eyes,Blond Hair,Male Characters,,2,1996
Anansa (New Earth),Bad Characters,,,Female Characters,,2,1995
Arel (New Earth),Good Characters,,,Male Characters,,2,1995
Captain Fear (New Earth),Bad Characters,,,Male Characters,,2,1995
Eduardo Reyes (New Earth),Bad Characters,,,Male Characters,,2,1995
Elbiam (New Earth),Good Characters,,,Male Characters,,2,1995
Fauna Faust (New Earth),Bad Characters,Black Eyes,White Hair,Female Characters,Homosexual Characters,2,1995
George Tweedle (New Earth),Bad Characters,Yellow Eyes,Black Hair,Male Characters,,2,1995
James Collins (New Earth),Bad Characters,,Black Hair,Male Characters,,2,1995
James Craddock II (New Earth),Neutral Characters,Blue Eyes,White Hair,Male Characters,,2,1995
Katherine Viverrida (New Earth),,Orange Eyes,,Female Characters,,2,1995
Lumiun (New Earth),Good Characters,,,Male Characters,,2,1995
Marsosh (New Earth),Good Characters,,,Male Characters,,2,1995
Peter Grogan (New Earth),,,Red Hair,Male Characters,,2,1995
Power Fork (New Earth),Bad Characters,,,Male Characters,,2,1995
Ribalvei (New Earth),Good Characters,,,Male Characters,,2,1995
Skinwalker (New Earth),Bad Characters,,,,,2,1995
Strega I (New Earth),Bad Characters,,Blond Hair,Female Characters,,2,1995
Techno (New Earth),Bad Characters,Brown Eyes,Black Hair,Male Characters,,2,1995
Voldar (New Earth),Good Characters,,,Male Characters,,2,1995
Alan Barnes (New Earth),Good Characters,,,Male Characters,,2,1994
Armless Master (New Earth),Neutral Characters,,,Male Characters,,2,1994
Brain-Bandit (New Earth),Bad Characters,Green Eyes,,Male Characters,,2,1994
Cecil Geekywad Bumwimple (New Earth),Bad Characters,,,Male Characters,,2,1994
Chromax (New Earth),Bad Characters,,,Male Characters,,2,1994
Dahak (New Earth),Bad Characters,,,,,2,1994
Drin (New Earth),Good Characters,,,Male Characters,,2,1994
Equinox (New Earth),Good Characters,Blue Eyes,Blond Hair,Male Characters,,2,1994
Ernest Widdle (New Earth),,,Blond Hair,Male Characters,,2,1994
Hardsell (New Earth),Bad Characters,Brown Eyes,Black Hair,Male Characters,,2,1994
Judomaster II (New Earth),Good Characters,,Black Hair,Male Characters,,2,1994
Kevin Crow Clone (New Earth),Bad Characters,,,Male Characters,,2,1994
Mainline (New Earth),Bad Characters,,,Male Characters,,2,1994
Matthew Nieman (New Earth),Bad Characters,,Black Hair,Male Characters,,2,1994
Megafire (New Earth),Bad Characters,,Blond Hair,Male Characters,,2,1994
Nuscia (New Earth),Good Characters,,Brown Hair,Female Characters,,2,1994
Peregrine (New Earth),Bad Characters,,,Male Characters,,2,1994
Phalanx (New Earth),Bad Characters,,,Male Characters,,2,1994
Probert (New Earth),Good Characters,,,Male Characters,,2,1994
Ricochet II (New Earth),Bad Characters,,,Male Characters,,2,1994
Solomon Perggia (New Earth),Bad Characters,,White Hair,Male Characters,,2,1994
Spellbinder II (New Earth),Bad Characters,,,Male Characters,,2,1994
Unclean (New Earth),Bad Characters,Brown Eyes,Brown Hair,Female Characters,,2,1994
Zephyr (New Earth),Bad Characters,Green Eyes,Red Hair,Female Characters,,2,1994
Blacksmyth (New Earth),Bad Characters,,,Male Characters,,2,1993
Blynde (New Earth),Bad Characters,,Blond Hair,Female Characters,,2,1993
Colin Brandywine (New Earth),Good Characters,White Eyes,Black Hair,Male Characters,,2,1993
Danthis (New Earth),Good Characters,,,Female Characters,,2,1993
Gyro (New Earth),Bad Characters,,,Male Characters,,2,1993
Hellen (New Earth),Good Characters,,,Female Characters,,2,1993
Immortal (New Earth),Bad Characters,Blue Eyes,Blond Hair,Male Characters,,2,1993
Jack Mobley (New Earth),Bad Characters,,,Male Characters,,2,1993
Krater (New Earth),Bad Characters,,Brown Hair,Male Characters,,2,1993
Lan Dibbux (New Earth),Good Characters,Yellow Eyes,,Male Characters,,2,1993
Lutefisk (New Earth),Bad Characters,,,Male Characters,,2,1993
Mekros (New Earth),Bad Characters,,,Male Characters,,2,1993
Shadowstryke (New Earth),Good Characters,,Black Hair,Male Characters,,2,1993
Shard (New Earth),Bad Characters,,,Male Characters,,2,1993
Toad-In-the-Hole (New Earth),Bad Characters,,,Male Characters,,2,1993
