name,ALIGN,EYE,HAIR,SEX,GSM,APPEARANCES,YEAR
Violet Parris (New Earth),Bad Characters,,Blond Hair,Female Characters,,6,2007
Bloodsport III (New Earth),Bad Characters,Brown Eyes,Black Hair,Male Characters,,6,2006
Bonita (New Earth),Neutral Characters,,Blond Hair,Female Characters,,6,2006
Brian Nudocerdo (New Earth),Bad Characters,Brown Eyes,,Male Characters,,6,2006
Copernicus the Dog (New Earth),,,Brown Hair,Female Characters,,6,2006
Griffin Grey (New Earth),Bad Characters,Blue Eyes,Grey Hair,Male Characters,,6,2006
Keane (New Earth),Bad Characters,Blue Eyes,Grey Hair,Male Characters,,6,2006
Libertine (New Earth),Good Characters,,,Male Characters,,6,2006
Little Barda (New Earth),Good Characters,Black Eyes,Brown Hair,Female Characters,,6,2006
Loragg (New Earth),Bad Characters,,,Male Characters,,6,2006
Mallory Kimball (New Earth),Good Characters,Brown Eyes,Brown Hair,Female Characters,Homosexual Characters,6,2006
Prime-7 (New Earth),Bad Characters,,,Male Characters,,6,2006
Scour (New Earth),Neutral Characters,Brown Eyes,Black Hair,Male Characters,,6,2006
Wild Huntsman III (New Earth),Bad Characters,,White Hair,Male Characters,,6,2006
Gleen (New Earth),Bad Characters,White Eyes,,Male Characters,,6,2005
Gloriana Tenebrae (New Earth),Bad Characters,Black Eyes,,Female Characters,,6,2005
Jongleur (New Earth),Bad Characters,,,Male Characters,,6,2005
Leviathan Entity (New Earth),,,,,,6,2005
Misty Kilgore (New Earth),Good Characters,Black Eyes,Black Hair,Female Characters,,6,2005
Rene Carpenter (New Earth),Neutral Characters,,Brown Hair,Female Characters,,6,2005
Ry Sovereign (New Earth),Good Characters,,Brown Hair,Male Characters,,6,2005
Thomas Ludlow Dalt (New Earth),Neutral Characters,Black Eyes,Black Hair,Male Characters,,6,2005
Virtuoso (New Earth),Bad Characters,Black Eyes,Black Hair,Female Characters,,6,2005
William Knightley (New Earth),Good Characters,,Brown Hair,Male Characters,,6,2005
Albert Davis (New Earth),Bad Characters,Blue Eyes,Blond Hair,Male Characters,,6,2004
Alice Cohen I (New Earth),Good Characters,,,Female Characters,,6,2004
Bernard Dowd (New Earth),,,Blond Hair,Male Characters,,6,2004
Curtis Leland (New Earth),,,,Male Characters,,6,2004
Darrin Profitt (New Earth),Bad Characters,,,Male Characters,,6,2004
Domina Paris (New Earth),Neutral Characters,,Blond Hair,Female Characters,,6,2004
Erich Donnerstein (New Earth),Bad Characters,Blue Eyes,Blond Hair,Male Characters,,6,2004
Hwa Rang (New Earth),Bad Characters,Brown Eyes,Black Hair,Male Characters,,6,2004
John Williamson (New Earth),,,Black Hair,Male Characters,,6,2004
Lyla (New Earth),Good Characters,Blue Eyes,Purple Hair,Female Characters,,6,2004
Mortimer Coolidge (New Earth),Bad Characters,,,Male Characters,,6,2004
Naif al-Sheikh (New Earth),Good Characters,Brown Eyes,Black Hair,Male Characters,,6,2004
Sidney Shiang (New Earth),Bad Characters,,Black Hair,Male Characters,,6,2004
Sonja (New Earth),Bad Characters,Green Eyes,Black Hair,Female Characters,,6,2004
Doctor Rovin (New Earth),Good Characters,Brown Eyes,Brown Hair,Male Characters,,6,2003
Montgomery Kelly (New Earth),Good Characters,,Brown Hair,Male Characters,,6,2003
Roger Elliot (New Earth),Bad Characters,,,Male Characters,,6,2003
Cole Parker (New Earth),Bad Characters,,Brown Hair,Male Characters,,6,2002
Susan Morrison (New Earth),,,Black Hair,Female Characters,,6,2002
Sylvia Sinclair (New Earth),Bad Characters,Blue Eyes,Blond Hair,Female Characters,,6,2002
Andi Kasinsky (New Earth),Good Characters,,,Female Characters,,6,2001
Joshua Jackam (New Earth),Good Characters,,Black Hair,Male Characters,,6,2001
Madison (Dakotaverse),Good Characters,Brown Eyes,Black Hair,Female Characters,,6,2001
Neil Borman (New Earth),Bad Characters,White Eyes,,Male Characters,,6,2001
Onimar Synn (New Earth),Bad Characters,Yellow Eyes,,Male Characters,,6,2001
Able Crown (New Earth),Bad Characters,,Black Hair,Male Characters,,6,2000
Amsel Reiniger (New Earth),Bad Characters,Blue Eyes,Blond Hair,Male Characters,,6,2000
Arrakhat (New Earth),Bad Characters,,,Male Characters,,6,2000
Diego Irigoyen (New Earth),Good Characters,Blue Eyes,Blond Hair,Male Characters,,6,2000
Hamilton Drew (New Earth),Good Characters,,Brown Hair,Male Characters,,6,2000
Maxwell Williams (New Earth),Good Characters,Brown Eyes,Brown Hair,Male Characters,,6,2000
Pablo Valdez (New Earth),,Brown Eyes,Black Hair,Male Characters,,6,2000
Ryuku Orsono (New Earth),Good Characters,Black Eyes,Black Hair,Male Characters,,6,2000
Stranglehold (New Earth),Bad Characters,,Black Hair,Female Characters,,6,2000
Adam Fells (New Earth),Bad Characters,,,Male Characters,,6,1999
Damien Darhk (New Earth),Bad Characters,Blue Eyes,Brown Hair,Male Characters,,6,1999
Devlos Ungol (New Earth),Bad Characters,Black Eyes,,Male Characters,,6,1999
Dina Bell (New Earth),Good Characters,Green Eyes,Red Hair,Female Characters,,6,1999
Ferak (New Earth),Neutral Characters,,Green Hair,Female Characters,,6,1999
Nite Lite (New Earth),Good Characters,Black Eyes,,Male Characters,,6,1999
Pino Maroni (New Earth),Bad Characters,,Black Hair,Male Characters,,6,1999
Jolene Relazzo (New Earth),Good Characters,,Brown Hair,Female Characters,,6,1998
Ratsputin (New Earth),Bad Characters,Red Eyes,Grey Hair,Male Characters,,6,1998
Sacker (New Earth),Bad Characters,Blue Eyes,White Hair,Male Characters,,6,1998
Sweet Sixteen (New Earth),Bad Characters,Blue Eyes,Red Hair,Female Characters,,6,1998
A-Mortal (New Earth),Bad Characters,Red Eyes,,Male Characters,,6,1997
Armek (New Earth),Bad Characters,,,Male Characters,,6,1997
Cassandra Cartland (New Earth),Bad Characters,Green Eyes,Brown Hair,Female Characters,,6,1997
Fluxus (New Earth),Bad Characters,,,Male Characters,,6,1997
Jarrod Jupiter (New Earth),Bad Characters,Blue Eyes,Brown Hair,Male Characters,,6,1997
Leander (New Earth),Good Characters,,Blue Hair,Male Characters,Homosexual Characters,6,1997
Primaid (New Earth),Bad Characters,,,Female Characters,,6,1997
Protex (New Earth),Bad Characters,,,Male Characters,,6,1997
Scorcher III (New Earth),Bad Characters,Brown Eyes,Black Hair,Female Characters,,6,1997
Shakes (New Earth),Good Characters,,Brown Hair,Male Characters,,6,1997
Tronix (New Earth),Bad Characters,Red Eyes,,Female Characters,,6,1997
Vera Burnsteel (New Earth),Good Characters,,Blond Hair,Female Characters,,6,1997
Zenturion (New Earth),Bad Characters,,,Male Characters,,6,1997
Z\u00fcM (New Earth),Bad Characters,,,Male Characters,,6,1997
Aarden (New Earth),,,Brown Hair,Male Characters,,6,1996
Andrew Howe (New Earth),Bad Characters,,Brown Hair,Male Characters,,6,1996
Beta Tos (New Earth),Good Characters,White Eyes,Red Hair,Female Characters,,6,1996
Carla Falcone (New Earth),Bad Characters,,Blond Hair,Female Characters,,6,1996
Catwalk (New Earth),,,Brown Hair,Female Characters,,6,1996
Cleveden Forbes (New Earth),Good Characters,Brown Eyes,Black Hair,Male Characters,,6,1996
Dawn Driscoll (New Earth),Good Characters,,Brown Hair,Female Characters,,6,1996
Dino-Mite I (New Earth),Good Characters,,,Male Characters,,6,1996
Dirk Armstrong (New Earth),Good Characters,,Brown Hair,Male Characters,,6,1996
Ephyra (New Earth),Good Characters,White Eyes,Blue Hair,Female Characters,,6,1996
Joy Page (New Earth),Good Characters,Blue Eyes,Blond Hair,Female Characters,,6,1996
Nemek (New Earth),Good Characters,,,Male Characters,,6,1996
Brian Bryan (New Earth),Good Characters,,,Male Characters,,6,1995
Jack Weston (New Earth),Good Characters,Brown Eyes,Brown Hair,Male Characters,,6,1995
John LaMonica (New Earth),Bad Characters,Brown Eyes,Black Hair,Male Characters,,6,1995
Scarth (New Earth),Bad Characters,,Blond Hair,Male Characters,,6,1995
Three Faces of Evil (New Earth),Bad Characters,Red Eyes,,,,6,1995
Adara (New Earth),Bad Characters,Blue Eyes,Green Hair,Female Characters,,6,1994
Coven (New Earth),Bad Characters,,Black Hair,Female Characters,,6,1994
Damien Kane (New Earth),Neutral Characters,Brown Eyes,Brown Hair,Male Characters,,6,1994
Dementor (New Earth),Bad Characters,,,Male Characters,,6,1994
Harold Ross (New Earth),Bad Characters,,Brown Hair,Male Characters,,6,1994
Honey (New Earth),,,Blond Hair,Female Characters,,6,1994
Jack Snyder (New Earth),Bad Characters,,Brown Hair,Male Characters,,6,1994
Jonathan Kellor (New Earth),Bad Characters,Blue Eyes,Brown Hair,Male Characters,,6,1994
Lady Dragon (New Earth),Bad Characters,,Black Hair,Female Characters,,6,1994
Loria (New Earth),Good Characters,Green Eyes,Black Hair,Female Characters,,6,1994
Slagg (New Earth),Bad Characters,,Brown Hair,Male Characters,,6,1994
Wild Huntsman I (New Earth),Bad Characters,,,Male Characters,,6,1994
Angora Lapin (New Earth),Bad Characters,Pink Eyes,White Hair,Female Characters,,6,1993
Brian Elliot (New Earth),Reformed Criminals,,Blond Hair,Male Characters,,6,1993
Camille Sly (New Earth),Good Characters,Blue Eyes,Black Hair,Female Characters,,6,1993
Ewald Olafsson (New Earth),Bad Characters,Blue Eyes,White Hair,Male Characters,,6,1993
FerAlyce (New Earth),Good Characters,Yellow Eyes,Black Hair,Female Characters,,6,1993
Jonas Glim (New Earth),Neutral Characters,,,Male Characters,,6,1993
Micah Rains (New Earth),Good Characters,,Brown Hair,Male Characters,,6,1993
Peggy Gardner (New Earth),,,,Female Characters,,6,1993
Powerhouse (New Earth),Bad Characters,,Blue Hair,Male Characters,,6,1993
Sylvia Eisenberg (New Earth),Good Characters,,Brown Hair,Female Characters,,6,1993
Candlemaker (New Earth),Bad Characters,Blue Eyes,,Male Characters,,6,1992
Daniel William Ducannon (New Earth),Bad Characters,Blue Eyes,White Hair,Male Characters,,6,1992
Hi-Tech (New Earth),Bad Characters,Blue Eyes,Red Hair,Female Characters,,6,1992
Hudson Pyle (New Earth),Neutral Characters,,Brown Hair,Male Characters,,6,1992
Jordan Wylie (New Earth),Bad Characters,Blue Eyes,Brown Hair,Male Characters,,6,1992
Echson Krystal (New Earth),,,Brown Hair,Male Characters,,6,1991
Karl Ranck (New Earth),Neutral Characters,,Blond Hair,Male Characters,,6,1991
Pyotr Raskov (New Earth),Good Characters,Brown Eyes,Grey Hair,Male Characters,,6,1991
Sumaan Harjavti (New Earth),Bad Characters,Brown Eyes,Black Hair,Male Characters,,6,1991
Tyrn Krystal (New Earth),,,Red Hair,Female Characters,,6,1991
Cora (New Earth),Good Characters,Blue Eyes,,Female Characters,,6,1990
Dardanus (New Earth),Bad Characters,Black Eyes,Blond Hair,Male Characters,,6,1990
Dren Keeg (New Earth),Neutral Characters,White Eyes,,Male Characters,,6,1990
Dwight Sykes (New Earth),Good Characters,,Black Hair,Male Characters,,6,1990
Marvin Noronsa (New Earth),Bad Characters,Brown Eyes,Black Hair,Male Characters,,6,1990
Michael Sykes (New Earth),Good Characters,,Black Hair,Male Characters,,6,1990
Tanya Fox (New Earth),Good Characters,Brown Eyes,Black Hair,Female Characters,,6,1990
Terri Eckhart (New Earth),Good Characters,Green Eyes,Red Hair,Female Characters,,6,1990
Yuga Khan (New Earth),,,,Male Characters,,6,1990
Azure (New Earth),Bad Characters,Blue Eyes,Black Hair,Female Characters,,6,1989
Benjamin Hecht (New Earth),Good Characters,,Grey Hair,Male Characters,,6,1989
Byron Shelley (New Earth),Bad Characters,,Brown Hair,Male Characters,,6,1989
Churljenkins (New Earth),Good Characters,Black Eyes,Green Hair,Female Characters,,6,1989
Ethel Cripps (New Earth),,,,Female Characters,,6,1989
Faruka (New Earth),Good Characters,,Brown Hair,Female Characters,,6,1989
Fred (New Earth),Good Characters,,,Male Characters,,6,1989
Lennox (New Earth),Bad Characters,Blue Eyes,White Hair,Male Characters,,6,1989
Lionel Hawkins (New Earth),Good Characters,,Brown Hair,Male Characters,,6,1989
Maritza Nitumbe (New Earth),Good Characters,Brown Eyes,Brown Hair,Female Characters,,6,1989
Melanie Boulder (New Earth),Good Characters,,Blond Hair,Female Characters,,6,1989
Nehebka (New Earth),Good Characters,Brown Eyes,Brown Hair,Female Characters,,6,1989
Oenone (New Earth),Good Characters,,Red Hair,Female Characters,,6,1989
Phillip Easton (New Earth),Neutral Characters,,Black Hair,Male Characters,,6,1989
Quiz (New Earth),Bad Characters,Brown Eyes,Black Hair,Female Characters,,6,1989
Rosa Rubikskova (New Earth),Good Characters,Green Eyes,Brown Hair,Female Characters,,6,1989
Russ Granger (New Earth),Good Characters,,White Hair,Male Characters,,6,1989
Silver Shield (New Earth),Neutral Characters,,,Male Characters,,6,1989
Stefano Mandragora (New Earth),Bad Characters,,White Hair,Male Characters,,6,1989
Teledar (New Earth),Good Characters,,,Male Characters,,6,1989
Tyrus (New Earth),Good Characters,,,Male Characters,,6,1989
Beth Zahar (New Earth),Good Characters,,Red Hair,Female Characters,,6,1988
Choi (New Earth),Bad Characters,Brown Eyes,Black Hair,Male Characters,,6,1988
Hecate (New Earth),Neutral Characters,,White Hair,Female Characters,,6,1988
Hugo Danner (New Earth),Bad Characters,,White Hair,Male Characters,,6,1988
Jamie Sawyer (New Earth),Good Characters,,Brown Hair,Female Characters,,6,1988
Katina Leikos (New Earth),Bad Characters,Brown Eyes,Black Hair,Female Characters,,6,1988
Legs (New Earth),Neutral Characters,Brown Eyes,Black Hair,Male Characters,,6,1988
Marcia Claiborne (New Earth),Good Characters,,Blond Hair,Female Characters,,6,1988
Maxwell Roger Castle (New Earth),Bad Characters,,Blond Hair,Male Characters,,6,1988
Runaround Sue (New Earth),Bad Characters,,Blond Hair,Female Characters,,6,1988
Siphon (New Earth),,,,Male Characters,,6,1988
Zuggernaut (New Earth),Bad Characters,Red Eyes,,Male Characters,,6,1988
Aella (New Earth),Good Characters,,,Female Characters,,6,1987
Ahtier (New Earth),Bad Characters,,,Female Characters,,6,1987
Branden (New Earth),Bad Characters,,Brown Hair,Male Characters,,6,1987
Cambodian (New Earth),Bad Characters,,,Male Characters,,6,1987
Cottus (New Earth),Bad Characters,Red Eyes,,,,6,1987
Fledermaus (New Earth),Bad Characters,,Red Hair,Male Characters,,6,1987
Helene Astar (New Earth),Bad Characters,,Black Hair,Female Characters,,6,1987
Mister Gilchrist (New Earth),,,White Hair,Male Characters,,6,1987
Noelle Avril (New Earth),,Blue Eyes,White Hair,Female Characters,,6,1987
Rachel Caspian (New Earth),Good Characters,,Red Hair,Female Characters,,6,1987
Robert DuBois (New Earth),Bad Characters,Brown Eyes,Black Hair,Male Characters,,6,1987
Stan the Pimp (New Earth),Bad Characters,,Brown Hair,Male Characters,,6,1987
Bog Venus (New Earth),Good Characters,,,Female Characters,,6,1986
Gerald Zimmerman (New Earth),Bad Characters,,,Male Characters,,6,1986
Jonathan Mann (New Earth),Good Characters,Blue Eyes,Brown Hair,Male Characters,,6,1986
Kettle Hole Devil (New Earth),Good Characters,,,Male Characters,,6,1986
Saint Columba (New Earth),Good Characters,,,Male Characters,,6,1986
Benjamin Love (New Earth),Bad Characters,Black Eyes,Black Hair,Male Characters,,6,1985
Jonni DC (New Earth),Neutral Characters,,Red Hair,Female Characters,,6,1985
Matthew Stein (New Earth),,Brown Eyes,Red Hair,Male Characters,,6,1985
Shamus (New Earth),,,Brown Hair,Male Characters,,6,1985
Vance Vanucci (New Earth),Bad Characters,Blue Eyes,Blond Hair,Male Characters,,6,1985
Yndamaati (New Earth),Good Characters,,,Female Characters,,6,1985
Bernard Bonner (New Earth),Bad Characters,,,Male Characters,,6,1984
Fay Evans (New Earth),Good Characters,,Brown Hair,Female Characters,,6,1984
Haifisch (New Earth),Bad Characters,Blue Eyes,Grey Hair,Male Characters,,6,1984
Henry P. Smithers (New Earth),,,Black Hair,Male Characters,,6,1984
Jerry Evans (New Earth),Good Characters,,Brown Hair,Male Characters,,6,1984
Kamah (New Earth),Bad Characters,Red Eyes,Orange Hair,Female Characters,,6,1984
Mama Madame (New Earth),Neutral Characters,White Eyes,White Hair,Female Characters,,6,1984
Rojek (New Earth),,,,Male Characters,,6,1984
Takeo Yamashiro (New Earth),Bad Characters,,Black Hair,Male Characters,,6,1984
Tezcatlipoca (New Earth),Bad Characters,,,Male Characters,,6,1984
Thomas Corbett (New Earth),Good Characters,Blue Eyes,Black Hair,Male Characters,,6,1984
Bedlam (New Earth),Bad Characters,,Red Hair,Male Characters,,6,1983
Ms. Mesmer (New Earth),Bad Characters,,Black Hair,Female Characters,,6,1983
Princess Topaz (New Earth),Neutral Characters,Yellow Eyes,Black Hair,Female Characters,,6,1983
Voss (New Earth),Good Characters,Red Eyes,Black Hair,Male Characters,,6,1983
Anthony Scarapelli (New Earth),Bad Characters,,Black Hair,Male Characters,,6,1982
Tuebeen (New Earth),Good Characters,,,Male Characters,,6,1982
Carl Woods (New Earth),Good Characters,Brown Eyes,Black Hair,Male Characters,,6,1981
Flying Buttress (New Earth),Good Characters,,,Male Characters,,6,1981
Ahriman (New Earth),Bad Characters,,,Male Characters,,6,1980
Virginia Hex (New Earth),Neutral Characters,,Brown Hair,Female Characters,,6,1980
Timothy Fox (New Earth),Bad Characters,Brown Eyes,Black Hair,Male Characters,,6,1979
Helen Jordan II (New Earth),,Blue Eyes,Brown Hair,Female Characters,,6,1978
Madame Zodiac (New Earth),Bad Characters,Blue Eyes,Red Hair,Female Characters,,6,1978
Armageddon (New Earth),Bad Characters,,,Male Characters,,6,1977
Barney Sands (New Earth),Good Characters,Blue Eyes,Brown Hair,Male Characters,,6,1977
Elizabeth Berg (New Earth),Good Characters,,Blond Hair,Female Characters,,6,1976
Richard Benson (New Earth),Good Characters,Grey Eyes,White Hair,Male Characters,,6,1975
Avia (New Earth),Good Characters,Blue Eyes,Blond Hair,Female Characters,,6,1972
James Corrigan (Earth-One),Good Characters,Black Eyes,Black Hair,Male Characters,,6,1972
Lump (New Earth),Bad Characters,White Eyes,,Male Characters,,6,1972
Victor Volcanum (New Earth),Bad Characters,,Black Hair,Male Characters,,6,1972
Ebeneezer Darrk (New Earth),Bad Characters,,,Male Characters,,6,1970
Richard Wilson (New Earth),Neutral Characters,Blue Eyes,Brown Hair,Male Characters,,6,1970
Mupo (New Earth),,,Black Hair,Male Characters,,6,1969
Andre de Sevigne (New Earth),Good Characters,,,Male Characters,,6,1968
Daisy (New Earth),,,,,,6,1968
Vera Sweet (New Earth),Neutral Characters,Green Eyes,Blond Hair,Female Characters,,6,1968
Pol Manning (New Earth),,,,Male Characters,,6,1967
Zborra (New Earth),Good Characters,Black Eyes,,Male Characters,,6,1967
Gagsworth A. Gagsworthy (New Earth),Bad Characters,,Brown Hair,Male Characters,,6,1966
Roy Reynolds (New Earth),Bad Characters,,Black Hair,Male Characters,,6,1965
Farmer Boy (New Earth),Good Characters,Blue Eyes,Blond Hair,Male Characters,,6,1964
Rog (New Earth),Bad Characters,,,,,6,1964
F. Gaylord Clayburne III (New Earth),Good Characters,Blue Eyes,Brown Hair,Male Characters,,6,1963
Thomas Jefferson (New Earth),Good Characters,,Red Hair,Male Characters,,6,1962
Jeanne Walker (New Earth),Good Characters,Blue Eyes,Blond Hair,Female Characters,,6,1961
John Wilkes Booth (New Earth),,,Brown Hair,Male Characters,,6,1961
Willard Wiggins (New Earth),,,,Male Characters,,6,1960
Jonathan Mayhew (New Earth),Bad Characters,Blue Eyes,Brown Hair,Male Characters,,6,1957
Ranger (New Earth),Good Characters,Green Eyes,Red Hair,Male Characters,,6,1955
Gerald Shilling (New Earth),Bad Characters,Brown Eyes,Brown Hair,Male Characters,,6,1954
Benedict Rundstrom (New Earth),Bad Characters,,,Male Characters,,6,1951
Edward Clariss (New Earth),Bad Characters,White Eyes,,Male Characters,,6,1949
Malachi Zee (New Earth),,,,Male Characters,,6,1947
Sky Pirate (New Earth),Bad Characters,,,Male Characters,,6,1947
Timothy Karnes (New Earth),Bad Characters,Brown Eyes,,Male Characters,,6,1943
Henry Ross (New Earth),Bad Characters,,,Male Characters,,6,1941
Ammon-Ra (New Earth),Neutral Characters,,,Male Characters,,6,
Kreaven (New Earth),Neutral Characters,,,Male Characters,,6,
Vulcan (New Earth),Good Characters,,,Male Characters,,6,
Donna Cavanagh (New Earth),Good Characters,Green Eyes,Blond Hair,Female Characters,Homosexual Characters,6,
Amadeus Arkham (New Earth),Good Characters,,,Male Characters,,6,
Bedbug (New Earth),Bad Characters,,,Male Characters,,5,2011
Black Python (New Earth),Bad Characters,,,Male Characters,,5,2011
Charles Lane II (New Earth),Bad Characters,,,Male Characters,,5,2011
Doctor Chaos (New Earth),Bad Characters,,,Male Characters,,5,2011
Enchantress (Prime Earth),Bad Characters,,Brown Hair,Female Characters,,5,2011
Etienne Guiborg (New Earth),Bad Characters,Blue Eyes,,Male Characters,,5,2011
Michael Desai (New Earth),Neutral Characters,Grey Eyes,,Male Characters,,5,2011
Orithia (New Earth),Good Characters,Green Eyes,Black Hair,Female Characters,,5,2011
Rani Singh (New Earth),Good Characters,Brown Eyes,Brown Hair,Male Characters,,5,2011
Sami Mousawi (New Earth),Bad Characters,,Brown Hair,Male Characters,,5,2011
Sara Butters (New Earth),Good Characters,,,Female Characters,,5,2011
Tataka (New Earth),Bad Characters,Red Eyes,Black Hair,Female Characters,,5,2011
Theodore Cobblepot (New Earth),Good Characters,,Grey Hair,Male Characters,,5,2011
Vijay Singh (New Earth),Good Characters,Brown Eyes,Brown Hair,Male Characters,,5,2011
Zachary Gate (New Earth),Bad Characters,Blue Eyes,Blond Hair,Male Characters,,5,2011
Catwoman III (New Earth),Neutral Characters,Blue Eyes,Black Hair,Female Characters,,5,2010
Chloe Sullivan (New Earth),Good Characters,Blue Eyes,Blond Hair,Female Characters,,5,2010
Dennis Ennis (New Earth),Good Characters,,Black Hair,Male Characters,,5,2010
Doctor Caligan (New Earth),Bad Characters,,Black Hair,Male Characters,,5,2010
Feng Po Impostor (New Earth),Neutral Characters,White Eyes,,Male Characters,,5,2010
Geomancer II (New Earth),Bad Characters,,,Male Characters,,5,2010
Goliath (New Earth),Bad Characters,White Eyes,Brown Hair,Male Characters,,5,2010
Green Ghoul (New Earth),Bad Characters,,Black Hair,Male Characters,,5,2010
Hans Gerlicht (New Earth),Bad Characters,,,Male Characters,,5,2010
Harold Winer (New Earth),Bad Characters,,Black Hair,Male Characters,,5,2010
Jackal III (New Earth),Bad Characters,,Blond Hair,Male Characters,,5,2010
Kristen Kramer (New Earth),,Blue Eyes,Red Hair,Female Characters,,5,2010
Mateo Burland (New Earth),Bad Characters,Black Eyes,Brown Hair,Male Characters,,5,2010
Milton Kroft (New Earth),Bad Characters,,Brown Hair,Male Characters,,5,2010
Nora Reid (New Earth),,Blue Eyes,Red Hair,Female Characters,,5,2010
Peter Hayes (New Earth),Bad Characters,Brown Eyes,Brown Hair,Male Characters,,5,2010
Yu Huang (New Earth),Good Characters,,,Male Characters,,5,2010
Abraham Arlington (New Earth),Good Characters,,,Male Characters,,5,2009
Archer of Angelsport (New Earth),Bad Characters,Brown Eyes,White Hair,Male Characters,,5,2009
Donna Anderson (New Earth),Neutral Characters,Green Eyes,Brown Hair,Female Characters,,5,2009
Face II (New Earth),Good Characters,Brown Eyes,,Male Characters,,5,2009
Jamal Stuart (New Earth),Good Characters,Brown Eyes,Black Hair,Male Characters,,5,2009
Malik Al Thaka (New Earth),Bad Characters,Red Eyes,,Male Characters,,5,2009
Millicent Mayne (New Earth),Good Characters,Blue Eyes,Brown Hair,Female Characters,,5,2009
Riki Kimura (New Earth),Good Characters,Black Eyes,Green Hair,Male Characters,,5,2009
Rocky (New Earth),Good Characters,White Eyes,,Male Characters,,5,2009
Sean Sonus (New Earth),Bad Characters,Blue Eyes,White Hair,Male Characters,,5,2009
Seductress (New Earth),Bad Characters,,Blond Hair,Female Characters,,5,2009
Son of the Fallen (New Earth),Good Characters,Black Eyes,Black Hair,Male Characters,,5,2009
Tyr-Van (New Earth),Good Characters,,Blond Hair,Male Characters,,5,2009
Ugly Man (New Earth),Bad Characters,,Black Hair,Male Characters,,5,2009
Burn (New Earth),Bad Characters,Blue Eyes,Brown Hair,Male Characters,,5,2008
Edwar Martinez (New Earth),Bad Characters,Black Eyes,,Male Characters,,5,2008
Gangly Man (New Earth),Bad Characters,,Brown Hair,Male Characters,,5,2008
Jesse (New Earth),Bad Characters,Red Eyes,Black Hair,Male Characters,,5,2008
Konvikt (New Earth),Bad Characters,,,Male Characters,,5,2008
Lycus (New Earth),Bad Characters,,,Male Characters,,5,2008
Marque (New Earth),Bad Characters,Black Eyes,Black Hair,Female Characters,,5,2008
Mind Bullet (New Earth),Bad Characters,,,Male Characters,,5,2008
Pierrot Lunaire (New Earth),Bad Characters,,,Male Characters,,5,2008
Sendrina (New Earth),Good Characters,Red Eyes,Brown Hair,Female Characters,,5,2008
Tuatara II (New Earth),Bad Characters,,,Male Characters,,5,2008
Violet (New Earth),Neutral Characters,,Red Hair,Female Characters,,5,2008
Bizarro Jimmy Olsen (New Earth),,Black Eyes,Red Hair,Male Characters,,5,2007
Branca (New Earth),Bad Characters,,,Male Characters,,5,2007
Brother Flay (New Earth),Bad Characters,Brown Eyes,Black Hair,Male Characters,,5,2007
Chien Na Wei (New Earth),Bad Characters,,White Hair,Female Characters,,5,2007
Diamalon (New Earth),Good Characters,Blue Eyes,,,,5,2007
Edward Hwang (New Earth),Bad Characters,,Black Hair,Male Characters,,5,2007
Enkafos (New Earth),Bad Characters,White Eyes,,Male Characters,,5,2007
Frank Halloran (New Earth),Neutral Characters,Photocellular Eyes,Blond Hair,Male Characters,,5,2007
Hackett (New Earth),Bad Characters,Brown Eyes,Brown Hair,Male Characters,,5,2007
Horku (New Earth),Bad Characters,White Eyes,,Male Characters,,5,2007
Jia (New Earth),Bad Characters,,Black Hair,Female Characters,,5,2007
Kid Crusader (New Earth),Bad Characters,Black Eyes,Black Hair,Male Characters,,5,2007
Kieran Marshall (New Earth),Good Characters,,,Male Characters,,5,2007
Mallow (New Earth),Bad Characters,,Grey Hair,Male Characters,,5,2007
Perseus Hazard (New Earth),,Brown Eyes,,Male Characters,,5,2007
Pharyngula (New Earth),Bad Characters,,,Male Characters,,5,2007
Scivor (New Earth),Bad Characters,,,,,5,2007
Snap Trap (New Earth),Bad Characters,,,Male Characters,,5,2007
Stanch (New Earth),Bad Characters,,,Male Characters,,5,2007
Thomas Larson (New Earth),Bad Characters,,Brown Hair,Male Characters,,5,2007
Chief Justice (New Earth),Bad Characters,Blue Eyes,Black Hair,Male Characters,,5,2006
